Symbol,Name,Last Sale,Net Change,% Change,Market Cap,Country,IPO Year,Volume,Sector,Industry
OXLCL,Oxford Lane Capital Corp. 6.75% Notes due 2031,$23.61,0.00,0.00%,4098696000.00,United States,,3915,Finance,Finance Companies
OXLCN,Oxford Lane Capital Corp. 7.125% Series 2029 Term Preferred Stock,$24.22,0.02,0.083%,4204592000.00,United States,,1120,Finance,Investment Managers
OXLCO,Oxford Lane Capital Corp. Preferred Stock Shares 6.00% Series 2029,$23.225,-0.055,-0.236%,4031860000.00,United States,,16257,Finance,Investment Managers
OXLCP,Oxford Lane Capital Corp. 6.25% Series 2027 Term Preferred Shares,$24.43,0.14,0.576%,4241048000.00,United States,,2551,Finance,Investment Managers
OXLCZ,Oxford Lane Capital Corp. 5.00% Notes due 2027,$24.25,0.03,0.124%,4209800000.00,United States,,9456,Finance,Finance Companies
OZK,Bank OZK Common Stock,$52.22,2.31,4.628%,5907968813.00,United States,,773759,Finance,Major Banks
PAA,Plains All American Pipeline L.P. Common Units representing Limited Partner Interests,$17.62,0.03,0.171%,12392224444.00,United States,1998,3628248,Energy,Natural Gas Distribution
PAGP,Plains GP Holdings L.P. Class A Units representing Limited Partner Interests,$18.96,0.05,0.264%,3749219111.00,United States,,1214410,Energy,Natural Gas Distribution
PANW,Palo Alto Networks Inc. Common Stock,$185.88,2.56,1.396%,123944784000.00,United States,,6858875,Technology,Computer peripheral equipment
PATK,Patrick Industries Inc. Common Stock,$116.04,4.93,4.437%,3861657563.00,United States,,334226,Consumer Discretionary,Auto Parts:O.E.M.
PAX,Patria Investments Limited Class A Common Shares,$13.42,0.21,1.59%,2121371761.00,Cayman Islands,2021,623075,Finance,Investment Managers
PAYO,Payoneer Global Inc. Common Stock,$7.01,0.36,5.414%,2525811956.00,United States,,4165359,Real Estate,Real Estate
PAYX,Paychex Inc. Common Stock,$140.81,2.40,1.734%,50725940320.00,United States,1983,2066284,Industrials,Diversified Commercial Services
PCAR,PACCAR Inc. Common Stock,$101.50,3.96,4.06%,53297994288.00,United States,,3345440,Consumer Discretionary,Motor Vehicles
PCH,PotlatchDeltic Corporation Common Stock,$43.79,1.60,3.792%,3384353940.00,United States,,875956,Real Estate,Real Estate Investment Trusts
PCT,PureCycle Technologies Inc. Common stock,$13.015,0.445,3.54%,2343911618.00,United States,,2255548,Industrials,Major Chemicals
PCTTU,PureCycle Technologies Inc. Unit,$17.80,0.00,0.00%,3205657073.00,United States,,80,Industrials,Major Chemicals
PCTY,Paylocity Holding Corporation Common Stock,$182.31,4.29,2.41%,10056516218.00,United States,2014,321889,Technology,Computer Software: Prepackaged Software
PCVX,Vaxcyte Inc. Common Stock,$32.29,0.38,1.191%,4191996133.00,United States,2020,1519128,Health Care,Biotechnology: Pharmaceutical Preparations
PDD,PDD Holdings Inc. American Depositary Shares,$127.11,4.15,3.375%,180451261785.00,China,2018,20137663,Technology,EDP Services
PECO,Phillips Edison & Company Inc. Common Stock,$34.845,1.055,3.122%,4376532000.00,United States,2021,907686,Real Estate,Real Estate Investment Trusts
PEGA,Pegasystems Inc. Common Stock,$52.93,1.81,3.541%,9055299598.00,United States,1996,1179915,Technology,EDP Services
PENN,PENN Entertainment Inc. Common Stock,$19.49,0.49,2.579%,2845631876.00,United States,1994,2787394,Consumer Discretionary,Hotels/Resorts
PEP,PepsiCo Inc. Common Stock,$149.64,0.66,0.443%,204868712807.00,United States,,5217408,Consumer Staples,Beverages (Production/Distribution)
PFG,Principal Financial Group Inc Common Stock,$80.72,2.05,2.606%,17981868558.00,United States,2001,1250491,Finance,Accident &Health Insurance
PGNY,Progyny Inc. Common Stock,$23.53,0.40,1.729%,2023166084.00,United States,2019,778569,Health Care,Misc Health and Biotechnology Services
PGY,Pagaya Technologies Ltd. Class A Ordinary Shares,$33.76,3.99,13.403%,2755100462.00,United States,,4164831,Finance,Finance: Consumer Services
PI,Impinj Inc. Common Stock,$176.82,8.61,5.119%,5143639339.00,United States,2016,503732,Technology,Industrial Machinery/Components
PINC,Premier Inc. Class A Common Stock,$25.14,-0.44,-1.72%,2075297975.00,United States,2013,1612583,Consumer Discretionary,Other Consumer Services
PLBL,Polibeli Group Ltd Class A Ordinary Shares,$11.28,-0.22,-1.913%,4194016800.00,Indonesia,,19822,Consumer Discretionary,Consumer Electronics/Appliances
PLMR,Palomar Holdings Inc. Common stock,$125.05,-1.82,-1.435%,3349272298.00,United States,2019,360977,Finance,Property-Casualty Insurers
PLTR,Palantir Technologies Inc. Class A Common Stock,$158.74,2.56,1.639%,376585635910.00,United States,,101837922,Technology,Computer Software: Prepackaged Software
PLXS,Plexus Corp. Common Stock,$137.26,6.71,5.14%,3704198011.00,United States,,151618,Technology,Electrical Products
PNFP,Pinnacle Financial Partners Inc. Common Stock,$96.19,3.80,4.113%,7460876158.00,United States,,1516088,Finance,Major Banks
PODD,Insulet Corporation Common Stock,$330.77,2.92,0.891%,23283738802.00,United States,2007,499565,Health Care,Medical/Dental Instruments
PONY,Pony AI Inc. American Depositary Shares ,$14.79,0.43,2.994%,5254776859.00,China,2024,4482847,Technology,EDP Services
POOL,Pool Corporation Common Stock,$323.73,15.10,4.893%,12080958730.00,United States,1995,736509,Consumer Discretionary,Industrial Specialties
POWI,Power Integrations Inc. Common Stock,$47.42,2.37,5.261%,2660052498.00,United States,1997,552429,Technology,Semiconductors
POWL,Powell Industries Inc. Common Stock,$262.95,12.02,4.79%,3173424697.00,United States,,422980,Energy,Electrical Products
POWWP,Outdoor Holding Company 8.75% Series A Cumulative Redeemable Perpetual Preferred Stock,$23.85,-0.15,-0.625%,2793093224.00,United States,,6573,Industrials,Ordnance And Accessories
PPBI,Pacific Premier Bancorp Inc,$24.305,1.515,6.648%,2357376949.00,United States,,1077921,Finance,Major Banks
PPC,Pilgrim's Pride Corporation Common Stock,$46.16,-1.10,-2.328%,10965190154.00,United States,,1512484,Consumer Staples,Meat/Poultry/Fish
PRCH,Porch Group Inc. Common Stock,$16.63,0.99,6.33%,2038523610.00,United States,2020,1899161,Technology,Computer Software: Prepackaged Software
PRCT,PROCEPT BioRobotics Corporation Common Stock,$41.23,1.88,4.778%,2293869847.00,United States,2021,727270,Health Care,Medical/Dental Instruments
PRDO,Perdoceo Education Corporation Common Stock,$33.37,0.58,1.769%,2167494257.00,United States,,852639,Real Estate,Other Consumer Services
PRGS,Progress Software Corporation Common Stock (DE),$46.70,1.99,4.451%,2013159805.00,United States,1991,749312,Technology,Computer Software: Prepackaged Software
PRVA,Privia Health Group Inc. Common Stock,$21.99,0.66,3.094%,2698831051.00,United States,2021,873119,Health Care,Medical/Nursing Services
PSIX,Power Solutions International Inc. Common Stock,$91.26,8.86,10.752%,2101703746.00,United States,,1024900,Industrials,Industrial Machinery/Components
PSKY,Paramount Skydance Corporation Class B Common Stock,$16.00,-0.03,-0.187%,10787598144.00,United States,,14863838,Industrials,Broadcasting
PSMT,PriceSmart Inc. Common Stock,$110.74,3.20,2.976%,3405685889.00,United States,,235216,Consumer Discretionary,Department/Specialty Retail Stores
PSNY,Polestar Automotive Holding UK PLC Class A ADS,$1.09,0.01,0.926%,2300286483.00,Sweden,,3714637,Industrials,Auto Manufacturing
PTC,PTC Inc. Common Stock,$215.05,3.10,1.463%,25761420995.00,United States,,668597,Technology,Computer Software: Prepackaged Software
PTCT,PTC Therapeutics Inc. Common Stock,$50.57,1.65,3.373%,4017184414.00,United States,2013,1050679,Health Care,Biotechnology: Pharmaceutical Preparations
PTEN,Patterson-UTI Energy Inc. Common Stock,$5.81,0.42,7.792%,2237823187.00,United States,1993,8688669,Energy,Oil & Gas Production
PTGX,Protagonist Therapeutics Inc. Common Stock,$57.48,1.44,2.57%,3575906559.00,United States,2016,470130,Health Care,Biotechnology: Pharmaceutical Preparations
PTON,Peloton Interactive Inc. Class A Common Stock,$7.91,0.22,2.861%,3225409593.00,United States,2019,8337830,Consumer Discretionary,Recreational Games/Products/Toys
PYPL,PayPal Holdings Inc. Common Stock,$69.90,2.35,3.479%,66780950510.00,United States,,9384539,Industrials,Diversified Commercial Services
QCOM,QUALCOMM Incorporated Common Stock,$158.01,3.88,2.517%,170492790000.00,United States,1991,7710417,Technology,Radio And Television Broadcasting And Communications Equipment
QFIN,Qfin Holdings Inc. American Depositary Shares,$31.45,0.78,2.543%,4233170000.00,China,2018,1580249,Finance,Finance: Consumer Services
QLYS,Qualys Inc. Common Stock,$134.54,3.92,3.001%,4856339561.00,United States,2012,289420,Technology,Computer Software: Prepackaged Software
QRVO,Qorvo Inc. Common Stock,$92.95,3.88,4.356%,8612213839.00,United States,,1870354,Technology,Semiconductors
QUBT,Quantum Computing Inc. Common Stock,$15.83,1.14,7.76%,2530950850.00,United States,,18100172,Technology,Computer Software: Prepackaged Software
RADX,Radiopharm Theranostics Limited American Depositary Shares,$5.67,0.02,0.354%,12320687487.00,Australia,,13951,,
RARE,Ultragenyx Pharmaceutical Inc. Common Stock,$29.78,0.26,0.881%,2869947529.00,United States,2014,1267925,Health Care,Biotechnology: Pharmaceutical Preparations
RDNT,RadNet Inc. Common Stock,$70.10,1.49,2.172%,5391815946.00,United States,,700892,Health Care,Medical Specialities
REG,Regency Centers Corporation Common Stock,$72.35,1.13,1.587%,13135382268.00,United States,1993,1314932,Real Estate,Real Estate Investment Trusts
REGCO,Regency Centers Corporation 5.875% Series B Cumulative Redeemable Preferred Stock,$22.72,0.14,0.62%,4124891294.00,United States,,1642,Real Estate,Real Estate Investment Trusts
REGCP,Regency Centers Corporation 6.25% Series A Cumulative Redeemable Preferred Stock,$23.90,0.07,0.294%,4339124205.00,United States,,698,Real Estate,Real Estate Investment Trusts
REGN,Regeneron Pharmaceuticals Inc. Common Stock,$589.48,-8.68,-1.451%,62477477310.00,United States,1991,1438656,Health Care,Biotechnology: Pharmaceutical Preparations
RELY,Remitly Global Inc. Common Stock,$19.05,0.43,2.309%,3927980784.00,United States,2021,3318801,Real Estate,Real Estate
REYN,Reynolds Consumer Products Inc. Common Stock,$23.40,0.32,1.386%,4921606638.00,United States,2020,657722,Consumer Discretionary,Containers/Packaging
RGC,Regencell Bioscience Holdings Limited Ordinary Shares,$12.80,0.24,1.911%,6329407386.00,Hong Kong,2021,164660,Health Care, Medicinal Chemicals and Botanical Products 
RGEN,Repligen Corporation Common Stock,$124.79,5.14,4.296%,7020388150.00,United States,1986,775450,Health Care,Biotechnology: Biological Products (No Diagnostic Substances)
RGLD,Royal Gold Inc. Common Stock,$177.44,2.69,1.539%,11681062044.00,United States,,635382,Industrials,Precious Metals
RGTI,Rigetti Computing Inc. Common Stock,$14.82,0.55,3.854%,4804127819.00,United States,,29687041,Technology,EDP Services
RIOT,Riot Platforms Inc. Common Stock ,$13.22,0.95,7.742%,4886418440.00,United States,,52167182,Finance,Finance: Consumer Services
RIVN,Rivian Automotive Inc. Class A Common Stock,$13.09,0.97,8.003%,15883851256.00,United States,2021,64512999,Industrials,Auto Manufacturing
RKLB,Rocket Lab Corporation Common Stock,$44.38,2.85,6.863%,21273806543.00,United States,2020,18743904,Industrials,Military/Government/Technical
RMBS,Rambus Inc. Common Stock,$73.77,3.33,4.727%,7937196101.00,United States,1997,1005931,Technology,Semiconductors
RNA,Avidity Biosciences Inc. Common Stock,$46.35,1.69,3.784%,5963082170.00,United States,2020,1887073,Health Care,Biotechnology: Pharmaceutical Preparations
RNW,ReNew Energy Global plc Class A Ordinary Shares,$7.79,0.12,1.565%,2825971632.00,United Kingdom,,1918638,Utilities,Electric Utilities: Central
ROAD,Construction Partners Inc. Class A Common Stock,$120.60,4.62,3.983%,6764467025.00,United States,2018,899152,Industrials,Military/Government/Technical
ROIV,Roivant Sciences Ltd. Common Shares,$11.92,0.11,0.931%,8139950377.00,United Kingdom,,4902270,Health Care,Biotechnology: Pharmaceutical Preparations
ROKU,Roku Inc. Class A Common Stock,$94.22,3.61,3.984%,13881492241.00,United States,2017,4121847,Telecommunications,Cable & Other Pay Television Services
ROP,Roper Technologies Inc. Common Stock,$536.84,9.90,1.879%,57771405276.00,United States,1992,673520,Technology,Computer Software: Programming Data Processing
ROST,Ross Stores Inc. Common Stock,$147.25,1.63,1.119%,48161134217.00,United States,1985,7736210,Consumer Discretionary,Clothing/Shoe/Accessory Stores
RPRX,Royalty Pharma plc Class A Ordinary Shares ,$36.32,0.01,0.028%,21180890503.00,United States,2020,2671527,Health Care,Biotechnology: Pharmaceutical Preparations
RRR,Red Rock Resorts Inc. Class A Common Stock,$61.44,1.64,2.742%,6481405256.00,United States,2016,792542,Consumer Discretionary,Hotels/Resorts
RUM,Rumble Inc. Class A Common Stock,$7.72,0.15,1.982%,3355643337.00,United States,2021,1558780,Technology,Computer Software: Programming Data Processing
RUN,Sunrun Inc. Common Stock,$16.20,1.46,9.905%,3737867666.00,United States,2015,16041439,Miscellaneous,Industrial Machinery/Components
RUSHA,Rush Enterprises Inc. Common Stock Cl A,$58.90,2.66,4.73%,4585928437.00,United States,,407056,Consumer Discretionary,Retail-Auto Dealers and Gas Stations
RUSHB,Rush Enterprises Inc. Class B,$59.22,3.42,6.129%,4610843499.00,United States,,70812,Consumer Discretionary,Retail-Auto Dealers and Gas Stations
RVMD,Revolution Medicines Inc. Common Stock,$37.01,0.53,1.453%,6918397362.00,United States,2020,1091784,Health Care,Biotechnology: Biological Products (No Diagnostic Substances)
RXRX,Recursion Pharmaceuticals Inc. Class A Common Stock,$4.94,0.16,3.347%,2144708583.00,United States,2021,19895557,Health Care,Biotechnology: Biological Products (No Diagnostic Substances)
RYAAY,Ryanair Holdings plc American Depositary Shares,$66.72,1.59,2.441%,35381600121.00,Ireland,1997,510897,Consumer Discretionary,Air Freight/Delivery Services
RYTM,Rhythm Pharmaceuticals Inc. Common Stock,$103.27,1.59,1.564%,6859202798.00,United States,2017,711780,Health Care,Biotechnology: Pharmaceutical Preparations
SAIA,Saia Inc. Common Stock,$320.27,26.32,8.954%,8530726452.00,United States,,778796,Industrials,Trucking Freight/Courier Services
SAIC,Science Applications International Corporation Common Stock,$119.19,0.97,0.821%,5586768436.00,United States,,287988,Technology,EDP Services
SAIL,SailPoint Inc. Common Stock,$20.50,0.99,5.074%,11410071425.00,United States,2025,1315236,Technology,Computer Software: Prepackaged Software
SANM,Sanmina Corporation Common Stock,$115.48,4.44,3.999%,6153288286.00,United States,1993,573655,Technology,Electrical Products
SATS,EchoStar  Corporation Common Stock,$29.62,2.12,7.709%,8522160716.00,United States,,2309242,Consumer Discretionary,Telecommunications Equipment
SBAC,SBA Communications Corporation Class A Common Stock,$222.87,1.98,0.896%,23931560627.00,United States,1999,513463,Real Estate,Real Estate Investment Trusts
SBCF,Seacoast Banking Corporation of Florida Common Stock,$30.97,1.80,6.171%,2720860524.00,United States,,1264864,Finance,Major Banks
SBET,SharpLink Gaming Inc. Common Stock,$20.87,2.83,15.687%,3524248530.00,Israel,,85201843,Technology,Computer Software: Prepackaged Software
SBLK,Star Bulk Carriers Corp. Common Shares,$19.12,0.14,0.738%,2239478393.00,Greece,,826867,Consumer Discretionary,Marine Transportation
SBRA,Sabra Health Care REIT Inc. Common Stock,$19.55,-0.07,-0.357%,4687936982.00,United States,,3551550,Real Estate,Real Estate Investment Trusts
SBUX,Starbucks Corporation Common Stock,$88.38,-0.18,-0.203%,100461546000.00,United States,1992,7618972,Consumer Discretionary,Restaurants
SEDG,SolarEdge Technologies Inc. Common Stock,$34.30,4.09,13.539%,2036555400.00,Israel,2015,4981028,Technology,Semiconductors
SEIC,SEI Investments Company Common Stock,$90.15,2.01,2.28%,11144799159.00,United States,1981,451945,Finance,Investment Bankers/Brokers/Service
SEZL,Sezzle Inc. Common Stock,$95.67,7.09,8.004%,3255024897.00,United States,,1255909,Real Estate,Real Estate
SFD,Smithfield Foods Inc. Common Stock,$25.94,0.23,0.895%,10197343723.00,United States,2025,902504,Consumer Staples,Meat/Poultry/Fish
SFM,Sprouts Farmers Market Inc. Common Stock,$146.28,-2.13,-1.435%,14295384001.00,United States,2013,1731491,Consumer Staples,Food Chains
SFNC,Simmons First National Corporation Class A Common Stock,$20.86,0.88,4.404%,3018461713.00,United States,,1177330,Finance,Major Banks
SGRY,Surgery Partners Inc. Common Stock,$23.64,0.78,3.412%,3030870452.00,United States,2015,1273842,Health Care,Hospital/Nursing Management
SHC,Sotera Health Company Common Stock,$16.43,0.50,3.139%,4666885737.00,United States,2020,1302737,Health Care,Misc Health and Biotechnology Services
SHOO,Steven Madden Ltd. Common Stock,$28.535,1.405,5.179%,2073136006.00,United States,1993,1449878,Consumer Discretionary,Shoe Manufacturing
SHOP,Shopify Inc. Class A Subordinate Voting Shares,$142.11,5.43,3.973%,184653212628.00,Canada,,7646931,Technology,Computer Software: Prepackaged Software
SIGI,Selective Insurance Group Inc. Common Stock,$78.71,0.60,0.768%,4789527428.00,United States,,592547,Finance,Property-Casualty Insurers
SIMO,Silicon Motion Technology Corporation American Depositary Shares,$76.43,2.23,3.005%,2597371898.00,Taiwan,2005,123021,Technology,Semiconductors
SIRI,SiriusXM Holdings Inc. Common Stock,$23.445,1.185,5.323%,7894880108.00,United States,,3753092,Consumer Discretionary,Broadcasting
SITM,SiTime Corporation Common Stock,$240.98,17.09,7.633%,6266437173.00,United States,2019,452582,Technology,Semiconductors
SKWD,Skyward Specialty Insurance Group Inc. Common Stock,$49.56,0.12,0.243%,2006518671.00,United States,2023,301599,Finance,Property-Casualty Insurers
SKYW,SkyWest Inc. Common Stock,$119.08,4.61,4.027%,4808242486.00,United States,1986,493473,Consumer Discretionary,Air Freight/Delivery Services
SLAB,Silicon Laboratories Inc. Common Stock,$145.12,10.10,7.48%,4762157787.00,United States,2000,548215,Technology,Semiconductors
SLM,SLM Corporation Common Stock,$31.73,0.89,2.886%,6615114187.00,United States,,1516625,Finance,Finance: Consumer Services
SLMBP,SLM Corporation Floating Rate Non-Cumulative Preferred Stock Series B,$76.04,0.02,0.026%,15852924135.00,United States,,3931,Finance,Finance: Consumer Services
SLNO,Soleno Therapeutics Inc. Common Stock,$68.57,-1.23,-1.762%,3644153267.00,United States,2014,1150393,Health Care,Biotechnology: Electromedical & Electrotherapeutic Apparatus
SMCI,Super Micro Computer Inc. Common Stock,$43.88,1.57,3.711%,26188358306.00,United States,2020,23997211,Technology,Computer Manufacturing
SMPL,The Simply Good Foods Company Common Stock,$30.17,0.80,2.724%,3033336934.00,United States,,1122034,Consumer Staples,Packaged Foods
SMTC,Semtech Corporation Common Stock,$51.09,1.70,3.442%,4426212446.00,United States,,2427306,Technology,Semiconductors
SNDK,Sandisk Corporation Common Stock,$46.37,0.87,1.912%,6737524739.00,United States,,2208268,Technology,Electronic Components
SNEX,StoneX Group Inc. Common Stock,$98.84,2.88,3.001%,5155945506.00,United States,,451123,Finance,Investment Bankers/Brokers/Service
SNPS,Synopsys Inc. Common Stock,$606.52,8.35,1.396%,94108212116.00,United States,1992,863211,Technology,Computer Software: Prepackaged Software
SNY,Sanofi ADS,$51.35,0.74,1.462%,129722703447.00,France,,1457301,Health Care,Biotechnology: Pharmaceutical Preparations
SOFI,SoFi Technologies Inc. Common Stock  ,$25.02,1.69,7.244%,29960201502.00,United States,,101269494,Finance,Finance: Consumer Services
SOUN,SoundHound AI Inc Class A Common Stock,$12.56,0.33,2.698%,5120539903.00,United States,,50681616,Technology,Computer Software: Prepackaged Software
SOUNW,SoundHound AI Inc. Warrant,$5.92,0.4542,8.31%,2413502884.00,United States,2021,55977,Technology,Computer Software: Prepackaged Software
SPNS,Sapiens International Corporation N.V. Common Shares (Cayman Islands),$42.77,0.06,0.14%,2390296613.00,Curacao,1992,957684,Technology,Computer Software: Prepackaged Software
SPSC,SPS Commerce Inc. Common Stock,$115.82,2.51,2.215%,4390592815.00,United States,2010,449293,Technology,Computer Software: Prepackaged Software
SRAD,Sportradar Group AG Class A Ordinary Shares,$31.63,0.46,1.476%,9471917459.00,Switzerland,2021,1540978,Technology,Computer Software: Programming Data Processing
SRRK,Scholar Rock Holding Corporation Common Stock,$35.49,0.90,2.602%,3411556635.00,United States,2018,2050027,Health Care,Biotechnology: Biological Products (No Diagnostic Substances)
SSNC,SS&C Technologies Holdings Inc. Common Stock,$90.20,1.50,1.691%,22028701818.00,United States,2010,1923985,Technology,Computer Software: Prepackaged Software
SSRM,SSR Mining Inc. Common Stock,$17.11,0.19,1.123%,3469569804.00,Canada,,5135331,Industrials,Precious Metals
STEP,StepStone Group Inc. Class A Common Stock,$61.71,3.00,5.11%,7285303518.00,United States,2020,488487,Finance,Investment Managers
STLD,Steel Dynamics Inc.,$132.68,6.92,5.503%,19531104869.00,United States,1996,2463505,Industrials,Steel/Iron Ore
STNE,StoneCo Ltd. Class A Common Shares,$15.35,0.52,3.506%,4168171097.00,Brazil,2018,4191397,Technology,EDP Services
STRC,Strategy Inc Variable Rate Series A Perpetual Stretch Preferred Stock,$95.05,0.61,0.646%,26951707612.00,United States,,721211,Technology,Computer Software: Prepackaged Software
STRD,Strategy Inc 10.00% Series A Perpetual Stride Preferred Stock,$79.83,0.83,1.051%,22636031759.00,United States,,124013,Technology,Computer Software: Prepackaged Software
STRF,Strategy Inc 10.00% Series A Perpetual Strife Preferred Stock,$111.24,0.34,0.307%,31542429824.00,United States,,436152,Technology,Computer Software: Prepackaged Software
STRK,Strategy Inc 8.00% Series A Perpetual Strike Preferred Stock,$96.50,0.71,0.741%,27362859386.00,United States,,378333,Technology,Computer Software: Prepackaged Software
STRL,Sterling Infrastructure Inc. Common Stock,$279.58,1.55,0.557%,8504776351.00,United States,,493572,Industrials,Military/Government/Technical
STX,Seagate Technology Holdings PLC Ordinary Shares (Ireland),$159.21,4.61,2.982%,33860333509.00,Ireland,2002,1920035,Technology,Electronic Components
SUPN,Supernus Pharmaceuticals Inc. Common Stock,$44.88,1.56,3.601%,2516560189.00,United States,2012,1047668,Health Care,Biotechnology: Pharmaceutical Preparations
SWKS,Skyworks Solutions Inc. Common Stock,$77.29,2.77,3.717%,11471966731.00,United States,,2391235,Technology,Semiconductors
SYBT,Stock Yards Bancorp Inc. Common Stock,$81.55,4.50,5.84%,2403550225.00,United States,,164868,Finance,Major Banks
SYM,Symbotic Inc. Class A Common Stock,$46.23,2.33,5.308%,27298505490.00,United States,2021,2382282,Industrials,Industrial Machinery/Components
SYNA,Synaptics Incorporated Common Stock $0.001 Par Value,$71.45,5.13,7.735%,2754072974.00,United States,2002,678028,Technology,Semiconductors
TARS,Tarsus Pharmaceuticals Inc. Common Stock,$57.25,0.69,1.22%,2416757569.00,United States,2020,615773,Health Care,Biotechnology: Biological Products (No Diagnostic Substances)
TBBK,The Bancorp Inc Common Stock,$72.73,5.20,7.70%,3350335451.00,United States,2004,1281906,Finance,Major Banks
TCBI,Texas Capital Bancshares Inc. Common Stock,$87.50,3.80,4.54%,4003575363.00,United States,2003,1160010,Finance,Major Banks
TCOM,Trip.com Group Limited American Depositary Shares,$64.92,1.30,2.043%,42410334948.00,China,2003,2899223,Real Estate,Real Estate
TEAM,Atlassian Corporation Class A Common Stock,$170.79,6.20,3.767%,44804115403.00,Australia,2015,1724939,Technology,Computer Software: Prepackaged Software
TECH,Bio-Techne Corp Common Stock,$57.09,3.09,5.722%,8949844872.00,United States,,1442419,Health Care,Biotechnology: Biological Products (No Diagnostic Substances)
TEM,Tempus AI Inc. Class A Common Stock,$80.52,3.81,4.967%,13988542970.00,United States,2024,18637808,Technology,Computer Software: Programming Data Processing
TENB,Tenable Holdings Inc. Common Stock,$30.68,0.60,1.995%,3715193311.00,United States,2018,1302210,Technology,Computer Software: Prepackaged Software
TER,Teradyne Inc. Common Stock,$115.30,6.00,5.489%,18341178240.00,United States,,4133904,Industrials,Electrical Products
TFSL,TFS Financial Corporation Common Stock,$13.75,0.50,3.774%,3859460330.00,United States,2007,344274,Finance,Savings Institutions
TGTX,TG Therapeutics Inc. Common Stock,$29.445,0.675,2.346%,4671908975.00,United States,,2182164,Health Care,Biotechnology: Pharmaceutical Preparations
TIGO,Millicom International Cellular S.A. Common Stock,$47.19,0.93,2.01%,8121224633.00,Luxembourg,,1171391,Telecommunications,Telecommunications Equipment
TIGR,UP Fintech Holding Ltd American Depositary Share representing fifteen Class A Ordinary Shares,$12.71,1.48,13.179%,2375446864.00,China,2019,14964567,Finance,Investment Bankers/Brokers/Service
TLN,Talen Energy Corporation Common Stock,$356.11,-1.75,-0.489%,16268997881.00,United States,,808032,Utilities,Electric Utilities: Central
TLX,Telix Pharmaceuticals Limited American Depositary Shares,$12.48,0.39,3.226%,4177361573.00,Australia,,161764,Health Care,Biotechnology: Pharmaceutical Preparations
TMDX,TransMedics Group Inc. Common Stock,$119.85,1.04,0.875%,4085729167.00,United States,2019,1032847,Health Care,Biotechnology: Electromedical & Electrotherapeutic Apparatus
TMUS,T-Mobile US Inc. Common Stock,$251.95,-6.21,-2.405%,283549326624.00,United States,,3984918,Telecommunications,Telecommunications Equipment
TOWN,TowneBank Common Stock,$37.20,1.70,4.789%,2775764676.00,United States,,644953,Finance,Major Banks
TPG,TPG Inc. Class A Common Stock,$60.94,0.85,1.415%,23027475620.00,United States,2022,1960831,Finance,Investment Managers
TPGXL,TPG Operating Group II L.P. 6.950% Fixed-Rate Junior Subordinated Notes due 2064,$26.01,0.00,0.00%,9489118408.00,United States,,17087,,
TRI,Thomson Reuters Corporation Common Shares,$178.55,2.46,1.397%,80469039878.00,United States,,1237461,Consumer Discretionary,Publishing
TRIP,TripAdvisor Inc. Common Stock,$17.69,0.74,4.366%,2054403225.00,United States,,2265588,Technology,Computer Software: Programming Data Processing
